{
  "authority": "proposal_only",
  "coordinate_system": {
    "camera_forward": "-Z",
    "handedness": "right",
    "id": "arkit_world",
    "matrix_layout": "row-major",
    "units": "meters",
    "vector_convention": "column-vector",
    "world_up": "+Y"
  },
  "created_at": "2026-01-02T03:04:05Z",
  "expected_frame_count": 2,
  "schema": "capture_splat.live_session.v0.1",
  "session_id": "fixture-session-01",
  "source_manifest": {
    "path": "capture.json",
    "schema": "capture_splat.v0.3",
    "sha256": "sha256:0000000000000000000000000000000000000000000000000000000000000000",
    "size_bytes": 123
  }
}
